[
  {
    "schema": "ax.normalized-result/v1",
    "surface": "api",
    "product": "fixture-db",
    "harness": "codex",
    "standard_set_version": "axarena-database-v1",
    "generated_at": "2026-07-18T00:00:00.000Z",
    "tasks_total": 7,
    "tasks_passed": 6,
    "pass_at_1": 0.8571428571428571,
    "pass_at_k": 0.8571428571428571,
    "attempts": 1,
    "discovery_score": null,
    "content_quality": null,
    "profiles": ["high"],
    "best_profile": "high",
    "model": "gpt-5.6-terra",
    "harness_version_raw": "codex-cli 0.121.0",
    "harness_version_semver": "0.121.0",
    "run_batch_id": "fixture-batch",
    "latency_ms": 1200,
    "total_duration_ms": 3900,
    "token_usage": { "input_tokens": 3000, "output_tokens": 600, "total_tokens": 3600 },
    "cost_usd": null,
    "summary_kind": "aggregate",
    "trial_count": 3,
    "task_consistency_at_3": 0.7142857142857143,
    "pass_3_tasks": 5,
    "pass_3_tasks_total": 7
  },
  {
    "schema": "ax.normalized-result/v1",
    "surface": "cli",
    "product": "fixture-db",
    "harness": "codex",
    "standard_set_version": "axarena-database-v1",
    "generated_at": "2026-07-18T00:00:00.000Z",
    "tasks_total": 7,
    "tasks_passed": 5,
    "pass_at_1": 0.7142857142857143,
    "pass_at_k": 0.7142857142857143,
    "attempts": 1,
    "discovery_score": null,
    "content_quality": null,
    "profiles": ["high"],
    "best_profile": "high",
    "model": "gpt-5.6-terra",
    "harness_version_raw": "codex-cli 0.121.0",
    "harness_version_semver": "0.121.0",
    "run_batch_id": "fixture-batch",
    "latency_ms": 1500,
    "total_duration_ms": 4800,
    "token_usage": { "input_tokens": 3400, "output_tokens": 700, "total_tokens": 4100 },
    "cost_usd": null,
    "summary_kind": "aggregate",
    "trial_count": 3,
    "task_consistency_at_3": 0.5714285714285714,
    "pass_3_tasks": 4,
    "pass_3_tasks_total": 7
  },
  {
    "schema": "ax.normalized-result/v1",
    "surface": "api",
    "product": "fixture-db",
    "harness": "claude-code",
    "standard_set_version": "axarena-database-v1",
    "generated_at": "2026-07-18T00:00:00.000Z",
    "tasks_total": 7,
    "tasks_passed": 6,
    "pass_at_1": 0.8571428571428571,
    "pass_at_k": 0.8571428571428571,
    "attempts": 1,
    "discovery_score": null,
    "content_quality": null,
    "profiles": ["high"],
    "best_profile": "high",
    "model": "claude-sonnet-5",
    "harness_version_raw": "2.1.5 (Claude Code)",
    "harness_version_semver": "2.1.5",
    "run_batch_id": "fixture-batch",
    "latency_ms": 1100,
    "total_duration_ms": 3600,
    "token_usage": { "input_tokens": 2800, "output_tokens": 550, "total_tokens": 3350 },
    "cost_usd": 0.42,
    "summary_kind": "aggregate",
    "trial_count": 3,
    "task_consistency_at_3": 0.7142857142857143,
    "pass_3_tasks": 5,
    "pass_3_tasks_total": 7
  },
  {
    "schema": "ax.normalized-result/v1",
    "surface": "cli",
    "product": "fixture-db",
    "harness": "claude-code",
    "standard_set_version": "axarena-database-v1",
    "generated_at": "2026-07-18T00:00:00.000Z",
    "tasks_total": 7,
    "tasks_passed": 7,
    "pass_at_1": 1,
    "pass_at_k": 1,
    "attempts": 1,
    "discovery_score": null,
    "content_quality": null,
    "profiles": ["high"],
    "best_profile": "high",
    "model": "claude-sonnet-5",
    "harness_version_raw": "2.1.5 (Claude Code)",
    "harness_version_semver": "2.1.5",
    "run_batch_id": "fixture-batch",
    "latency_ms": 1300,
    "total_duration_ms": 4000,
    "token_usage": { "input_tokens": 3100, "output_tokens": 620, "total_tokens": 3720 },
    "cost_usd": 0.51,
    "summary_kind": "aggregate",
    "trial_count": 3,
    "task_consistency_at_3": 0.8571428571428571,
    "pass_3_tasks": 6,
    "pass_3_tasks_total": 7
  }
]
